Symbol,Name,Last Sale,Net Change,% Change,Market Cap,Country,IPO Year,Volume,Sector,Industry
AAMC,Altisource Asset Management Corp Com,$53.2001,-0.5099,-0.949%,94547484.00,United States,,3708,Finance,Investment Managers
AAU,Almaden Minerals Ltd. Common Shares,$0.2041,-0.0007,-0.342%,28006889.00,Canada,2015,169769,,
ACU,Acme United Corporation. Common Stock,$25.55,0.55,2.20%,90312326.00,United States,1988,33980,Consumer Discretionary,Home Furnishings
ADEX,Adit EdTech Acquisition Corp. Common Stock,$10.22,0.00,0.00%,352590000.00,,2021,1,Industrials,Consumer Electronics/Appliances
ADRT,Ault Disruptive Technologies Corporation Common Stock,$10.40,0.00,0.00%,149500000.00,,2022,750,Industrials,Consumer Electronics/Appliances
AE,Adams Resources & Energy Inc. Common Stock,$57.32,0.28,0.491%,140571797.00,United States,1980,52841,Energy,Oilfield Services/Equipment
AEF,abrdn Emerging Markets Equity Income Fund Inc. Common Stock,$5.33,0.09,1.718%,270506977.00,United States,,22355,Finance,Finance/Investors Services
AGE,AgeX Therapeutics Inc. Common Stock,$0.6181,0.0284,4.816%,23455135.00,,2018,4236,Health Care,Biotechnology: Pharmaceutical Preparations
AIM,AIM ImmunoTech Inc. Common Stock,$0.539,0.019,3.654%,21392916.00,United States,1997,60368,Health Care,Biotechnology: Biological Products (No Diagnostic Substances)
AINC,Ashford Inc. (Holding Company) Common Stock,$13.59,0.49,3.74%,42333679.00,United States,2014,5071,Finance,Investment Managers
AIRI,Air Industries Group Common Stock,$5.00,-0.01,-0.20%,16239685.00,United States,,6719,Industrials,Military/Government/Technical
AMBO,Ambow Education Holding Ltd. American Depository Shares each representing two Class A ordinary shares,$0.3099,0.0219,7.604%,7869343.00,China,,27393,Consumer Discretionary,Service to the Health Industry
AMPE,Ampio Pharmaceuticals Inc.,$0.2799,0.001,0.359%,4222513.00,United States,2022,43861,Health Care,Biotechnology: Pharmaceutical Preparations
AMS,American Shared Hospital Services Common Stock,$3.1356,0.1056,3.485%,19293347.00,United States,1988,27102,Health Care,Medical Specialities
APT,Alpha Pro Tech Ltd. Common Stock,$4.17,0.04,0.969%,52187367.00,Canada,2000,26171,,
AREN,The Arena Group Holdings Inc. Common Stock,$7.08,-0.03,-0.422%,129586606.00,,2022,23528,Technology,Interactive Media
ARMP,Armata Pharmaceuticals Inc. Common Stock,$2.76,-0.015,-0.541%,99759389.00,United States,,3743,Health Care,Biotechnology: Biological Products (No Diagnostic Substances)
ASM,Avino Silver & Gold Mines Ltd. Common Shares (Canada),$0.71,0.0014,0.198%,84027854.00,Canada,,290080,,
ASXC,Asensus Surgical Inc. Common Stock,$0.73,0.0419,6.089%,172893120.00,United States,,2057528,Health Care,Medical/Dental Instruments
ATNM,Actinium Pharmaceuticals Inc. (Delaware) Common Stock,$10.13,0.07,0.696%,258145890.00,United States,,207967,Health Care,Biotechnology: Pharmaceutical Preparations
AULT,Ault Alliance Inc. Common Stock,$0.1248,0.0104,9.091%,49258287.00,United States,1997,4775045,Industrials,Military/Government/Technical
AULT^D,Ault Alliance Inc. 13.00% Series D Cumulative Redeemable Perpetual Preferred Stock,$13.8999,0.1999,1.459%,,United States,,4925,,
AUMN,Golden Minerals Company Common Stock,$0.225,0.0089,4.118%,37682548.00,United States,,334423,Basic Materials,Precious Metals
AUST,Austin Gold Corp. Common Shares,$0.8894,-0.0082,-0.914%,11803894.00,,2022,21734,,
AWX,Avalon Holdings Corporation Common Stock,$2.9407,0.1357,4.838%,11467057.00,United States,1998,56690,Utilities,Environmental Services
BATL,Battalion Oil Corporation Common Stock,$8.65,0.33,3.966%,141382650.00,,,9573,Energy,Oil & Gas Production
BCV,Bancroft Fund Ltd.,$18.30,0.23,1.273%,106843781.00,United States,1972,15726,Finance,Finance/Investors Services
BCV^A,Bancroft Fund Limited 5.375% Series A Cumulative Preferred Shares,$23.55,-0.01,-0.042%,,United States,,2608,,
BDL,Flanigan's Enterprises Inc. Common Stock,$28.47,0.08,0.282%,52915680.00,United States,1972,7695,Consumer Discretionary,Restaurants
BGI,Birks Group Inc. Common Stock,$8.24,0.00,0.00%,154343185.00,Canada,,17754,,
BHB,Bar Harbor Bankshares Inc. Common Stock,$29.76,-0.26,-0.866%,448870080.00,United States,1997,9216,Finance,Major Banks
BHM,Bluerock Homes Trust Inc. Class A Common Stock,$21.02,0.13,0.622%,80790412.00,,2022,19814,Real Estate,Real Estate Investment Trusts
BKTI,BK Technologies Corporation Common Stock,$3.2599,-0.0901,-2.69%,55367110.00,United States,,9347,Technology,Radio And Television Broadcasting And Communications Equipment
BMTX,BM Technologies Inc. Common Stock,$3.33,0.05,1.524%,40754029.00,,2018,56248,Technology,EDP Services
BRBS,Blue Ridge Bankshares Inc. Common Stock,$12.10,-0.01,-0.083%,229298981.00,,,22216,Finance,Commercial Banks
BRN,Barnwell Industries Inc. Common Stock,$2.46,0.08,3.361%,24493450.00,United States,1965,19311,Energy,Oil & Gas Production
BTG,B2Gold Corp Common shares (Canada),$3.58,0.00,0.00%,3846948661.00,Canada,,6144957,,
BTTR,Better Choice Company Inc. Common Stock,$0.6935,-0.0141,-1.993%,20392734.00,,2021,15374,Consumer Discretionary,Food Distributors
BURU,Nuburu Inc. Common Stock,$5.00,0.24,5.042%,170834420.00,,2020,47574,Technology,Industrial Machinery/Components
CANF,Can-Fite Biopharma Ltd Sponsored ADR (Israel),$2.71,0.01,0.37%,9593817.00,Israel,,20930,Health Care,Biotechnology: Pharmaceutical Preparations
CATX,Perspective Therapeutics Inc. Common Stock,$0.37,0.01,2.778%,103103401.00,United States,,150401,Health Care,Medical Specialities
CCEL,Cryo-Cell International Inc. Common Stock,$3.88,0.04,1.042%,33054690.00,United States,2022,2974,Health Care,Managed Health Care
CCF,Chase Corporation Common Stock,$101.62,1.09,1.084%,965391829.00,United States,1995,17060,Consumer Discretionary,Paints/Coatings
CEI,Camber Energy Inc. Common Stock,$1.78,0.10,5.952%,31603829.00,United States,,1780408,Energy,Oil & Gas Production
CET,Central Securities Corporation Common Stock,$35.60,0.47,1.338%,995959342.00,United States,1951,17054,Finance,Finance/Investors Services
CEV,Eaton Vance California Municipal Income Trust Shares of Beneficial Interest,$9.93,0.10,1.017%,69843400.00,United States,1999,16733,Finance,Finance/Investors Services
CIK,Credit Suisse Asset Management Income Fund Inc. Common Stock,$2.79,-0.01,-0.357%,146025788.00,United States,,173814,Finance,Finance/Investors Services
CIX,CompX International Inc. Common Stock,$18.70,0.09,0.484%,230143836.00,United States,1998,3869,Technology,Security Systems Services
CKX,CKX Lands Inc. Common Stock,$9.90,-0.30,-2.941%,19546827.00,United States,2003,270,Energy,Oil & Gas Production
CLM,Cornerstone Strategic Value Fund Inc. New Common Stock,$8.10,0.06,0.746%,1657030187.00,United States,2003,1071682,Finance,Finance/Investors Services
CMCL,Caledonia Mining Corporation Plc Common Shares,$13.64,-0.53,-3.74%,235744376.00,Canada,,45768,Basic Materials,Precious Metals
CMT,Core Molding Technologies Inc Common Stock,$17.34,0.01,0.058%,154679771.00,United States,1996,52108,Consumer Discretionary,Electronic Components
COHN,Cohen & Company Inc.,$8.8212,-0.1273,-1.423%,15145489.00,United States,,4356,Finance,Investment Managers
CPHI,China Pharma Holdings Inc. Common Stock,$0.0632,-0.0058,-8.406%,3263808.00,China,,4576610,Health Care,Biotechnology: Pharmaceutical Preparations
CQP,Cheniere Energy Partners LP Cheniere Energy Partners LP Common Units,$49.38,-0.35,-0.704%,23901481544.00,United States,2007,368652,Utilities,Oil/Gas Transmission
CRF,Cornerstone Total Return Fund Inc. (The) Common Stock,$7.66,0.04,0.525%,744165630.00,United States,2003,756982,Finance,Finance/Investors Services
CTGO,Contango ORE Inc. Common Stock,$23.5999,0.1899,0.811%,170329163.00,,2021,478,Basic Materials,Precious Metals
CTM,Castellum Inc. Common Stock,$0.99,0.05,5.319%,41833036.00,,2022,55167,Technology,EDP Services
CVM,Cel-Sci Corporation Common Stock,$2.96,0.62,26.496%,129467040.00,United States,1997,461021,Health Care,Biotechnology: Biological Products (No Diagnostic Substances)
CVR,Chicago Rivet & Machine Co. Common Stock,$30.28,0.05,0.165%,29254477.00,United States,1930,299,Consumer Discretionary,Industrial Specialties
CVU,CPI Aerostructures Inc. Common Stock,$3.76,-0.18,-4.569%,46561686.00,United States,2022,40639,Industrials,Military/Government/Technical
CYBN,Cybin Inc. Common Shares,$0.4595,-0.0025,-0.541%,87300055.00,,,1492091,Health Care,Pharmaceuticals and Biotechnology
DC,Dakota Gold Corp. Common Stock,$2.98,0.09,3.114%,218071188.00,,2022,134550,Basic Materials,Precious Metals
DHY,Credit Suisse High Yield Bond Fund Common Stock,$1.91,0.00,0.00%,197711234.00,United States,1998,270835,Finance,Finance/Investors Services
DIT,AMCON Distributing Company Common Stock,$173.47,3.43,2.017%,105999190.00,United States,1999,100,Consumer Discretionary,Food Distributors
DLA,Delta Apparel Inc. Common Stock,$14.00,0.64,4.79%,98014280.00,United States,2000,24987,Consumer Discretionary,Department/Specialty Retail Stores
DMF,BNY Mellon Municipal Income Inc. Common Stock,$6.18,0.02,0.325%,128279910.00,United States,1988,66075,Finance,Finance/Investors Services
DMYY,dMY Squared Technology Group Inc. Class A Common Stock,$10.23,-0.04,-0.389%,0.00,,2022,905,Industrials,Consumer Electronics/Appliances
DNN,Denison Mines Corp Ordinary Shares (Canada),$1.28,0.02,1.587%,1052434785.00,Canada,,3949506,,
DPSI,DecisionPoint Systems Inc. Common Stock,$7.65,0.00,0.00%,56590829.00,,2022,8136,Technology,Retail: Computer Software & Peripheral Equipment
DSS,DSS Inc. Common Stock,$0.23,0.0021,0.921%,31973950.00,United States,,82073,,
DXF,Dunxin Financial Holdings Limited American Depositary Shares,$0.1775,0.0175,10.938%,3706056.00,China,,549418,Consumer Discretionary,Apparel
EAD,Allspring Income Opportunities Fund Common Shares,$6.68,0.04,0.602%,398968184.00,United States,2003,188482,Finance,Finance/Investors Services
ECF,Ellsworth Growth and Income Fund Ltd.,$8.69,0.14,1.637%,119102238.00,United States,1986,36864,Finance,Finance/Investors Services
ECF^A,Ellsworth Growth and Income Fund Ltd. 5.25% Series A Cumulative Preferred Shares (Liquidation Preference $25.00 per share),$23.03,0.11,0.48%,,United States,,100,,
EFSH,1847 Holdings LLC Common Shares,$1.385,-0.065,-4.483%,5961698.00,,2022,17344,Industrials,Consumer Electronics/Appliances
EIM,Eaton Vance Municipal Bond Fund Common Shares of Beneficial Interest $.01 par value,$10.08,0.10,1.002%,725288095.00,United States,2002,138418,Finance,Finance/Investors Services
ELA,Envela Corporation Common Stock,$7.58,0.17,2.294%,204086808.00,United States,,24381,Consumer Discretionary,Consumer Specialties
ELLO,Ellomay Capital Ltd Ordinary Shares (Israel),$12.50,0.00,0.00%,160657313.00,Israel,,35,Utilities,Electric Utilities: Central
ELMD,Electromed Inc. Common Stock,$13.00,-0.30,-2.256%,110684132.00,United States,2011,16822,Health Care,Biotechnology: Electromedical & Electrotherapeutic Apparatus
EMAN,eMagin Corporation Common Stock,$1.10,0.00,0.00%,86038230.00,United States,,110690,Technology,Industrial Machinery/Components
EMX,EMX Royalty Corporation Common Shares (Canada),$2.00,0.03,1.523%,221194380.00,Canada,,154225,,
ENSV,Enservco Corporation Common Stock,$0.60,0.025,4.348%,7133308.00,United States,,317271,Energy,Oilfield Services/Equipment
ENX,Eaton Vance New York Municipal Bond Fund Common Shares of Beneficial Interest $.01 par value,$9.11,-0.06,-0.654%,163627343.00,United States,2002,34127,Finance,Finance/Investors Services
EP,Empire Petroleum Corporation Common Stock,$12.26,-0.60,-4.666%,270897634.00,United States,2022,27817,Energy,Oil & Gas Production
EPM,Evolution Petroleum Corporation Inc. Common Stock,$6.81,0.14,2.099%,229614813.00,United States,,172535,Energy,Oil & Gas Production
EQX,Equinox Gold Corp. Common Shares,$3.89,0.07,1.832%,1186671049.00,Canada,,1018947,,
ERC,Allspring Multi-Sector Income Fund Common Stock,$9.86,0.02,0.203%,276546496.00,United States,2003,55771,Finance,Finance/Investors Services
ERH,Allspring Utilities and High Income Fund Common Shares,$10.68,0.15,1.425%,99241305.00,,2004,10944,Finance,Finance/Investors Services
ESP,Espey Mfg. & Electronics Corp. Common Stock,$19.8509,-0.139,-0.695%,53649697.00,United States,1960,6817,Technology,Industrial Machinery/Components
EU,enCore Energy Corp. Common Shares,$2.27,-0.01,-0.439%,271568785.00,,2023,192314,,
EVBN,Evans Bancorp Inc. Common Stock,$38.60,-0.07,-0.181%,209870053.00,United States,,4866,Finance,Major Banks
EVI,EVI Industries Inc.  Common Stock,$19.99,0.04,0.201%,251200777.00,United States,1999,23364,Industrials,Industrial Machinery/Components
EVM,Eaton Vance California Municipal Bond Fund Common Shares of Beneficial Interest $.01 par value,$8.78,0.10,1.152%,216628404.00,United States,2002,52400,Finance,Finance/Investors Services
EVV,Eaton Vance Limited Duration Income Fund Common Shares of Beneficial Interest,$10.21,0.13,1.29%,1186437327.00,United States,2003,359951,Finance,Finance/Investors Services
FAX,abrdn Asia-Pacific Income Fund Inc. Common Stock,$2.73,0.01,0.368%,676209449.00,United States,1986,801931,Finance,Investment Managers
FCO,abrdn Global Income Fund Inc. Common Stock,$5.5301,-0.0399,-0.716%,62324974.00,United States,1992,62811,Finance,Investment Managers
FEN,First Trust Energy Income and Growth Fund,$13.84,0.10,0.728%,269377899.00,United States,2004,36449,Finance,Finance/Investors Services
FGH,FG Group Holdings Inc. Common Stock,$2.21,-0.03,-1.339%,43027924.00,United States,,51112,Consumer Discretionary,Industrial Machinery/Components
FLAG,First Light Acquisition Group Inc. Class A Common Stock,$10.26,0.00,0.00%,101348526.00,,2021,5,Industrials,Consumer Electronics/Appliances
FOXO,FOXO Technologies Inc. Class A Common Stock,$0.6399,-0.0551,-7.928%,17615851.00,,2022,1415789,Technology,Retail: Computer Software & Peripheral Equipment
FRD,Friedman Industries Inc. Common Stock,$12.49,0.24,1.959%,92121094.00,United States,1975,19689,Industrials,Steel/Iron Ore
FSI,Flexible Solutions International Inc. Common Stock (CDA),$3.10,0.01,0.324%,38521406.00,Canada,2002,10564,Consumer Discretionary,Recreational Games/Products/Toys
FSP,Franklin Street Properties Corp. Common Stock,$2.42,0.04,1.681%,249830912.00,United States,,1187820,Real Estate,Real Estate Investment Trusts
FTF,Franklin Limited Duration Income Trust Common Shares of Beneficial Interest,$6.435,0.035,0.547%,260008582.00,United States,2003,162748,Finance,Finance/Investors Services
FURY,Fury Gold Mines Limited Common Shares,$0.6125,0.0063,1.039%,85425957.00,,2020,58089,,
GAU,Galiano Gold Inc.,$0.519,-0.0038,-0.727%,116745652.00,Canada,,109904,,
GBR,New Concept Energy Inc Common Stock,$1.255,0.015,1.21%,6440577.00,United States,1993,2454,Real Estate,Real Estate
GENC,Gencor Industries Inc. Common Stock,$14.45,0.20,1.404%,211803794.00,United States,,22530,Industrials,Construction/Ag Equipment/Trucks
GGN,GAMCO Global Gold Natural Resources & Income Trust,$3.69,-0.01,-0.27%,568844197.00,United States,2005,406599,Finance,Finance/Investors Services
GGN^B,GAMCO Global Gold Natural Reources & Income Trust 5.00% Series B Cumulative 25.00 Liquidation Preference,$22.55,0.156,0.697%,,United States,,3813,,
GLDG,GoldMining Inc. Common Shares,$1.05,-0.01,-0.943%,174559546.00,,,361845,,
GLO,Clough Global Opportunities Fund Common Stock,$4.93,0.06,1.232%,214680409.00,United States,2006,345534,Finance,Finance/Investors Services
GLQ,Clough Global Equity Fund Clough Global Equity Fund Common Shares of Beneficial Interest,$6.09,0.095,1.585%,116468942.00,United States,2005,97312,Finance,Finance/Investors Services
GLTA,Galata Acquisition Corp. Class A Ordinary Shares,$10.35,0.00,0.00%,185976563.00,,2021,1,Consumer Discretionary,Rental/Leasing Companies
GLU,Gabelli Global Utility Common Shares of Beneficial Ownership,$14.66,0.21,1.453%,87504235.00,United States,2004,17643,Finance,Finance/Investors Services
GLU^B,The Gabelli Global Utility and Income Trust Series B Cumulative Puttable and Callable Preferred Shares,$49.84,0.0679,0.136%,,United States,,4287,,
GLV,Clough Global Dividend and Income Fund Common Shares of beneficial interest,$6.05,0.10,1.681%,76892977.00,United States,2004,60198,Finance,Finance/Investors Services
GNS,Genius Group Limited Ordinary Shares,$3.63,1.35,59.211%,89627107.00,,2022,62993268,Real Estate,Other Consumer Services
GORO,Gold Resource Corporation Common Stock,$0.9838,0.026,2.715%,86966060.00,United States,,933664,Basic Materials,Precious Metals
GRF,Eagle Capital Growth Fund Inc. Common Stock,$8.3601,0.0145,0.174%,32830639.00,United States,,2354,Finance,Finance/Investors Services
GRFX,Graphex Group Limited American Depositary Shares each American Depositary Share representing 20 Ordinary Shares,$1.72,0.00,0.00%,58776103.00,,2022,19752,,
GROY,Gold Royalty Corp. Common Shares,$2.17,-0.07,-3.125%,312291360.00,,2021,321880,,
GSAT,Globalstar Inc. Common Stock,$1.25,0.06,5.042%,2251250000.00,United States,2006,3259937,Consumer Discretionary,Telecommunications Equipment
GTE,Gran Tierra Energy Inc. Common Stock,$0.87,0.03,3.571%,301151507.00,Canada,,6626700,Energy,Oil & Gas Production
HNRA,HNR Acquisition Corp Common Stock,$10.40,0.00,0.00%,120965000.00,,2022,10,Industrials,Consumer Electronics/Appliances
HNW,Pioneer Diversified High Income Fund Inc.,$10.56,0.08,0.763%,88015055.00,United States,2007,14429,Finance,Finance/Investors Services
HUSA,Houston American Energy Corporation Common Stock,$3.25,0.05,1.563%,32267099.00,United States,,179354,Energy,Oil & Gas Production
HWM^,Howmet Aerospace Inc. $3.75 Preferred Stock,$64.226,0.976,1.543%,,United States,,565,,
HZON,Horizon Acquisition Corporation II Class A Ordinary Shares,$10.112,0.0219,0.217%,306884315.00,United States,2020,414,Finance,Blank Checks
IAF,abrdn Australia Equity Fund Inc. Common Stock,$4.83,0.08,1.684%,120422425.00,United States,1985,30989,Finance,Finance/Investors Services
IAUX,i-80 Gold Corp. Common Shares,$2.36,0.07,3.057%,567269936.00,,2022,1414227,,
IBIO,iBio Inc. Common Stock,$1.61,0.03,1.899%,19914338.00,United States,,1945871,Health Care,Biotechnology: Pharmaceutical Preparations
ID,PARTS iD Inc. Class A Common Stock,$0.40,-0.0212,-5.033%,13645780.00,United States,2017,26673,Consumer Discretionary,Auto Parts:O.E.M.
IDR,Idaho Strategic Resources Inc. Common Stock,$5.12,-0.08,-1.538%,61942118.00,,2022,5505,Basic Materials,Precious Metals
IDW,IDW Media Holdings Class B Common Stock,$0.9027,-0.0073,-0.802%,12709572.00,,2021,836,Consumer Discretionary,Newspapers/Magazines
IE,Ivanhoe Electric Inc. Common Stock,$15.83,0.58,3.803%,1470415742.00,,2022,479652,Basic Materials,Metal Mining
IGC,India Globalization Capital Inc. Common Stock,$0.3848,-0.0002,-0.052%,20424197.00,United States,,102722,Consumer Discretionary,Engineering & Construction
IHT,InnSuites Hospitality Trust Shares of Beneficial Interest,$1.7499,0.1899,12.173%,15954736.00,United States,1999,3770,Real Estate,Real Estate Investment Trusts
IMH,Impac Mortgage Holdings Inc. Common Stock ,$0.3517,0.0505,16.766%,12860604.00,United States,1997,126523,Finance,Finance: Consumer Services
IMO,Imperial Oil Limited Common Stock,$51.61,0.35,0.683%,30148121776.00,Canada,1929,333674,,
INDO,Indonesia Energy Corporation Limited Ordinary Shares,$5.49,0.17,3.195%,55683390.00,,2019,44477,Energy,Oil & Gas Production
INFU,InfuSystems Holdings Inc. Common Stock,$9.60,0.08,0.84%,198301190.00,United States,,13087,Health Care,Medical/Dental Instruments
INLX,Intellinetics Inc. Common Stock,$4.151,0.0009,0.022%,,,2022,720,Technology,EDP Services
INTT,inTest Corporation Common Stock,$14.27,-0.45,-3.057%,157297482.00,United States,1997,153707,Technology,Semiconductors
INUV,Inuvo Inc.,$0.3931,0.0043,1.106%,47225023.00,United States,,150349,Consumer Discretionary,Advertising
IOR,Income Opportunity Realty Investors Inc. Common Stock,$11.6069,0.00,0.00%,48382364.00,United States,1987,28,Finance,Diversified Financial Services
IPVF,InterPrivate III Financial Partners Inc. Class A Common Stock,$10.21,0.06,0.591%,339342113.00,,2021,963,Industrials,Consumer Electronics/Appliances
ISDR,Issuer Direct Corporation Common Stock,$26.0015,0.0315,0.121%,98572207.00,United States,,5030,Technology,Computer Software: Prepackaged Software
ITP,IT Tech Packaging Inc. Common Stock,$0.55,0.0223,4.226%,6278756.00,China,,10992,Basic Materials,Paper
ITRG,Integra Resources Corp. Common Shares,$0.5598,0.0056,1.01%,44562842.00,,,88251,,
JOB,GEE Group Inc. Common Stock,$0.438,0.0162,3.841%,50129299.00,United States,1968,307850,Consumer Discretionary,Diversified Commercial Services
KIQ,Kelso Technologies Inc Ordinary Shares,$0.3784,0.0189,5.257%,20554721.00,Canada,,60368,,
KNW,Know Labs Inc. Common Stock,$1.05,0.0314,3.083%,50618334.00,,2022,134917,Industrials,Industrial Machinery/Components
KULR,KULR Technology Group Inc. Common Stock,$1.25,-0.07,-5.303%,140933234.00,United States,,670612,,
LCTX,Lineage Cell Therapeutics Inc. Common Stock,$1.40,0.01,0.719%,209973886.00,United States,,249112,Health Care,Biotechnology: Biological Products (No Diagnostic Substances)
LEU,Centrus Energy Corp. Class A Common Stock,$42.71,0.01,0.023%,620992979.00,United States,2014,448453,,
LGL,LGL Group Inc. (The) Common Stock,$4.65,0.00,0.00%,24891157.00,United States,1946,976,Technology,Industrial Machinery/Components
LNG,Cheniere Energy Inc. Common Stock,$164.38,1.06,0.649%,40874633158.00,United States,2001,2063567,Utilities,Oil/Gas Transmission
LODE,Comstock Inc. Common Stock,$0.312,0.0145,4.874%,29911341.00,United States,,656012,Finance,Real Estate
LPTV,Loop Media Inc. Common Stock,$5.85,0.05,0.862%,329830073.00,,2022,12005,Industrials,Broadcasting
LSF,Laird Superfood Inc. Common Stock,$1.07,-0.0301,-2.736%,9868206.00,,2020,26656,Consumer Staples,Specialty Foods
LXFR,Luxfer Holdings PLC Ordinary Shares,$16.10,0.12,0.751%,438059120.00,United Kingdom,2012,79813,Industrials,Metal Fabrications
MAG,MAG Silver Corporation Ordinary Shares,$12.33,0.29,2.409%,1268172607.00,Canada,,501305,,
MAIA,MAIA Biotechnology Inc. Common Stock,$4.60,-0.08,-1.709%,50351158.00,,2022,29303,Health Care,Biotechnology: Pharmaceutical Preparations
MGLD,The Marygold Companies Inc. Common Stock,$1.75,0.10,6.061%,69007433.00,,2022,13007,Finance,Finance/Investors Services
MHH,Mastech Digital Inc Common Stock,$12.73,0.28,2.249%,147893436.00,United States,,3631,Consumer Discretionary,Professional Services
MIMO,Airspan Networks Holdings Inc. Common Stock,$1.28,-0.02,-1.538%,94623352.00,,2020,7113,Consumer Discretionary,Telecommunications Equipment
MITQ,Moving iMage Technologies Inc. Common Stock,$1.202,-0.008,-0.661%,13171994.00,United States,2021,98791,Telecommunications,Telecommunications Equipment
MLSS,Milestone Scientific Inc. Common Stock,$0.80,0.01,1.266%,55836264.00,United States,2015,221496,Health Care,Industrial Specialties
MNK,Mallinckrodt plc Ordinary Shares,$9.11,0.39,4.472%,119987191.00,,2022,10945,Health Care,Biotechnology: Pharmaceutical Preparations
MPTI,M-tron Industries Inc. Common Stock,$10.30,-0.05,-0.483%,28086019.00,,2022,2225,,
MPU,Mega Matrix Corp. Common Stock,$1.59,0.09,6.00%,50186846.00,United States,1998,19939,Consumer Discretionary,Diversified Commercial Services
MSN,Emerson Radio Corporation Common Stock,$0.5568,-0.0182,-3.165%,11716549.00,United States,1994,12089,Consumer Staples,Consumer Electronics/Appliances
MTA,Metalla Royalty & Streaming Ltd. Common Shares,$4.65,0.05,1.087%,209318536.00,,,133686,,
MTNB,Matinas Biopharma Holdings Inc. Common Stock,$0.498,0.0193,4.032%,107998534.00,United States,2017,163723,Health Care,Biotechnology: Pharmaceutical Preparations
MXC,Mexco Energy Corporation Common Stock,$13.00,0.30,2.362%,27846000.00,United States,2003,6931,Energy,Oil & Gas Production
MYO,Myomo Inc. Common Stock,$0.665,0.005,0.758%,13448926.00,United States,2017,286500,Health Care,Industrial Specialties
NAK,Northern Dynasty Minerals Ltd. Common Stock,$0.221,0.008,3.756%,117081245.00,Canada,,510133,,
NAVB,Navidea Biopharmaceuticals Inc. Common Stock,$0.3428,0.0279,8.86%,11094503.00,United States,,48539,Health Care,Biotechnology: In Vitro & In Vivo Diagnostic Substances
NBH,Neuberger Berman Municipal Fund Inc. Common Stock,$10.36,0.03,0.29%,195215179.00,United States,2002,55603,Finance,Finance/Investors Services
NBO,Neuberger Berman New York Municipal Fund Inc. Common Stock,$9.41,0.13,1.401%,47778494.00,United States,2002,23048,Finance,Finance/Investors Services
NBW,Neuberger Berman California Municipal Fund Inc Common Stock,$10.55,0.05,0.476%,58563514.00,United States,2002,16931,Finance,Finance/Investors Services
NBY,NovaBay Pharmaceuticals Inc. Common Stock,$2.23,0.03,1.364%,4184470.00,United States,2007,3710,Health Care,Biotechnology: Pharmaceutical Preparations
NEN,New England Realty Associates Limited Partnership Class A Depositary Receipts Evidencing Units of Limited Partnership,$74.95,0.00,0.00%,268143818.00,United States,,88,Finance,Real Estate
NEWP,New Pacific Metals Corp. Common Shares,$2.57,-0.03,-1.154%,403616637.00,,2021,54570,,
NFGC,New Found Gold Corp Common Shares,$3.74,0.06,1.63%,655516397.00,,2021,138873,,
NG,Novagold Resources Inc.,$5.80,0.09,1.576%,1937001164.00,Canada,2003,507954,,
NGD,New Gold Inc.,$0.9319,-0.0238,-2.49%,636301320.00,Canada,,2583369,,
NHC,National HealthCare Corporation Common Stock,$55.05,-0.17,-0.308%,845314164.00,United States,1986,95183,Health Care,Hospital/Nursing Management
NHS,Neuberger Berman High Yield Strategies Fund,$8.31,0.05,0.605%,161484407.00,United States,,89678,Finance,Trusts Except Educational Religious and Charitable
NHWK,NightHawk Biosciences Inc. Common Stock,$0.9462,0.0162,1.742%,24280900.00,United States,2022,23448,Health Care,Biotechnology: Pharmaceutical Preparations
NML,Neuberger Berman MLP and Energy Income Fund Inc. Common Stock,$7.07,0.01,0.142%,400578621.00,,2013,153467,Finance,Finance/Investors Services
NNVC,NanoViricides Inc. Common Stock,$1.38,0.02,1.471%,16056300.00,United States,,19109,Health Care,Biotechnology: Pharmaceutical Preparations
